<?xml version="1.0" encoding="UTF-8"?>

<xs:schema xmlns:xs="http://www.w3.org/2001/XMLSchema">
    <xs:element name="users">
        <xs:complexType>
            <xs:sequence>
                <xs:element name="user" minOccurs="0" maxOccurs="unbounded">
                    <xs:complexType>
                        <xs:sequence>
                            <xs:element name="name">
                                <xs:complexType>
                                    <xs:sequence>
                                        <xs:element name="first" type="xs:string" />
                                        <xs:element name="last" type="xs:string" />
                                    </xs:sequence>
                                </xs:complexType>
                            </xs:element>
                            <xs:element name="email" type="xs:string" />
                            <xs:element name="username" type="xs:string" />
                            <xs:element name="password" type="xs:string" />
                            <xs:element name="location">
                                <xs:complexType>
                                    <xs:sequence>
                                        <xs:element name="country" type="xs:string" />
                                        <xs:element name="city" type="xs:string" />
                                    </xs:sequence>
                                </xs:complexType>
                            </xs:element>
                        </xs:sequence>
                        <xs:attribute name="userType" type="xs:string" use="required" />
                        <xs:attribute name="userId" type="xs:positiveInteger" use="required" />
                        <xs:attribute name="title" type="xs:string" />
                    </xs:complexType>
                </xs:element>
            </xs:sequence>
        </xs:complexType>
    </xs:element>
</xs:schema>